{
  "assets": [
    {
      "id": "pine",
      "file": "tree_3d_model_fir_spruce_pine.glb",
      "height": 7.5
    },
    {
      "id": "maple",
      "file": "maple_tree.glb",
      "height": 8
    },
    {
      "id": "bags",
      "file": "animal_crossing_new_horizons_trash_bags.glb",
      "height": 0.6
    },
    {
      "id": "dumpster",
      "file": "heavy_duty_dumpster.glb",
      "height": 1.94
    },
    {
      "id": "container",
      "file": "container_low.glb",
      "size": [
        2.44,
        2.59,
        12.19
      ]
    }
  ],
  "materials": {
    "cardboard": {
      "key": "cyberpunk/prop-cardboard/poor",
      "variant": "kraft"
    },
    "wood": {
      "key": "cyberpunk/prop-wood/poor",
      "variant": "sawn"
    },
    "paint": {
      "key": "cyberpunk/prop-coating/poor",
      "variant": "worn"
    },
    "metal": {
      "key": "cyberpunk/metal/poor",
      "variant": "zinc"
    },
    "polymer": {
      "key": "cyberpunk/prop-polymer/poor",
      "variant": "charcoal"
    },
    "polymer-face": {
      "key": "cyberpunk/prop-polymer-face/poor",
      "variant": "scored"
    },
    "fabric": {
      "key": "cyberpunk/fabric/poor",
      "variant": "1"
    }
  },
  "models": [
    {
      "id": "carton-small",
      "kind": "box",
      "shape": "carton",
      "size": [
        0.46,
        0.3,
        0.36
      ]
    },
    {
      "id": "carton-tall",
      "kind": "box",
      "shape": "carton",
      "size": [
        0.48,
        0.62,
        0.42
      ]
    },
    {
      "id": "carton-wide",
      "kind": "box",
      "shape": "carton",
      "size": [
        0.8,
        0.26,
        0.56
      ]
    },
    {
      "id": "carton-open",
      "kind": "box",
      "shape": "carton",
      "size": [
        0.58,
        0.4,
        0.46
      ],
      "open": true
    },
    {
      "id": "crate-small",
      "kind": "crate",
      "shape": "crate",
      "size": [
        0.7,
        0.56,
        0.54
      ]
    },
    {
      "id": "crate-large",
      "kind": "crate",
      "shape": "crate",
      "size": [
        1,
        0.72,
        0.65
      ]
    },
    {
      "id": "pallet",
      "kind": "pallet",
      "shape": "pallet",
      "size": [
        1.2,
        0.14,
        0.8
      ]
    },
    {
      "id": "paper",
      "kind": "litter",
      "shape": "paper",
      "size": [
        0.28,
        0.016,
        0.38
      ]
    },
    {
      "id": "can",
      "kind": "litter",
      "shape": "can",
      "size": [
        0.07,
        0.08,
        0.13
      ]
    },
    {
      "id": "bag",
      "kind": "bag",
      "asset": "bags",
      "tints": [
        "#535e5e",
        "#61726d",
        "#a4a9a4"
      ]
    },
    {
      "id": "dumpster",
      "kind": "dumpster",
      "asset": "dumpster",
      "tints": [
        "#ffffff",
        "#a4afb8",
        "#aab8a0"
      ]
    },
    {
      "id": "cargo-40",
      "kind": "container",
      "asset": "container",
      "size": [
        2.44,
        2.59,
        12.19
      ],
      "cargo": true,
      "tints": [
        "#63818a",
        "#8e654b",
        "#73816b"
      ]
    },
    {
      "id": "cargo-20",
      "kind": "container",
      "asset": "container",
      "size": [
        2.44,
        2.59,
        6.06
      ],
      "cargo": true,
      "tints": [
        "#8e654b",
        "#73816b",
        "#63818a"
      ]
    },
    {
      "id": "pine",
      "kind": "tree",
      "asset": "pine",
      "tints": [
        "#ffffff",
        "#dbe8dd"
      ]
    },
    {
      "id": "maple",
      "kind": "tree",
      "asset": "maple",
      "tints": [
        "#ffffff",
        "#e5e6cf"
      ]
    },
    {
      "id": "poly-tote",
      "kind": "crate",
      "shape": "polymer",
      "size": [
        0.64,
        0.42,
        0.46
      ],
      "lid": "none",
      "damage": {
        "dent": 0.028,
        "twist": 0.06,
        "sag": 0.018,
        "taper": 0.07
      },
      "tints": [
        "#ffffff",
        "#a6afa8",
        "#9ba5b2"
      ]
    },
    {
      "id": "poly-transit",
      "kind": "box",
      "shape": "polymer",
      "size": [
        0.76,
        0.36,
        0.5
      ],
      "lid": "sealed",
      "damage": {
        "dent": 0.018,
        "twist": 0.025,
        "sag": 0.01,
        "taper": 0.015
      },
      "tints": [
        "#ffffff",
        "#a6afa8",
        "#9ba5b2"
      ]
    },
    {
      "id": "poly-crushed",
      "kind": "crate",
      "shape": "polymer",
      "size": [
        0.62,
        0.31,
        0.5
      ],
      "lid": "none",
      "damage": {
        "dent": 0.095,
        "twist": 0.17,
        "sag": 0.075,
        "taper": 0.13
      },
      "tints": [
        "#ffffff",
        "#a6afa8",
        "#9ba5b2"
      ]
    },
    {
      "id": "poly-loose",
      "kind": "box",
      "shape": "polymer",
      "size": [
        0.66,
        0.43,
        0.48
      ],
      "lid": "loose",
      "damage": {
        "dent": 0.055,
        "twist": -0.075,
        "sag": 0.035,
        "taper": 0.035
      },
      "tints": [
        "#ffffff",
        "#a6afa8",
        "#9ba5b2"
      ]
    },
    {
      "id": "relay-cabinet",
      "kind": "ornament",
      "shape": "cabinet",
      "size": [
        0.68,
        1.36,
        0.38
      ],
      "open": false,
      "tints": [
        "#8d9692",
        "#667574",
        "#948577"
      ]
    },
    {
      "id": "pump-cabinet",
      "kind": "ornament",
      "shape": "cabinet",
      "size": [
        0.91,
        0.92,
        0.5
      ],
      "open": true,
      "tints": [
        "#566b69",
        "#8a785d",
        "#797f89"
      ]
    },
    {
      "id": "bench-repaired",
      "kind": "ornament",
      "shape": "bench",
      "size": [
        1.72,
        0.88,
        0.5
      ],
      "open": true,
      "tints": [
        "#9a9689",
        "#718582",
        "#7c818b"
      ]
    },
    {
      "id": "memorial-shrine",
      "kind": "ornament",
      "shape": "memorial",
      "size": [
        0.58,
        0.86,
        0.43
      ],
      "open": false,
      "tints": [
        "#7e8786",
        "#8c8777",
        "#8e979a"
      ]
    },
    {
      "id": "tarp-shelter",
      "kind": "ornament",
      "shape": "shelter",
      "size": [
        2.2,
        1.45,
        1.7
      ],
      "open": false,
      "tints": [
        "#3e5d7a",
        "#55663c",
        "#6f4a36",
        "#56585c"
      ]
    },
    {
      "id": "street-stall",
      "kind": "ornament",
      "shape": "stall",
      "size": [
        1.6,
        2.25,
        0.95
      ],
      "open": true,
      "tints": [
        "#8a3f33",
        "#3f6e6a",
        "#8f7a3e",
        "#4c5560"
      ]
    },
    {
      "id": "oil-drum",
      "kind": "ornament",
      "shape": "drum",
      "size": [
        0.58,
        0.88,
        0.58
      ],
      "open": false,
      "tints": [
        "#3f5d48",
        "#6d3a2b",
        "#2f3f5c",
        "#5b5b52"
      ]
    }
  ],
  "detailColors": {
    "tape": "#9f8460",
    "label": "#e0d8c1",
    "ink": "#293333",
    "warning": "#807253",
    "seal": "#242b2b"
  },
  "finishes": [
    {
      "id": "worn",
      "offset": [
        0,
        0
      ],
      "phase": 0.3,
      "wear": 0.12
    },
    {
      "id": "weathered",
      "offset": [
        0.23,
        0.41
      ],
      "phase": 2.7,
      "wear": 0.34,
      "materials": {
        "polymer-face": {
          "key": "cyberpunk/prop-polymer-face/poor",
          "variant": "abraded"
        }
      }
    },
    {
      "id": "salvaged",
      "offset": [
        0.57,
        0.16
      ],
      "phase": 5.8,
      "wear": 0.24
    }
  ]
}
